{
  "schema": "sefirot-chat-answer-v1",
  "fixture_id": "demo:contract:unknown",
  "requested_scope": [
    "demo:contract:unknown"
  ],
  "mode": "HOLD",
  "phase_source": "NOT_ATTESTED",
  "observed_at": null,
  "received_at": null,
  "answered_at": "2026-10-11T17:00:00+00:00",
  "runtime_status": "SEFIROT_NOT_EXECUTED",
  "model_build": null,
  "model_hash": null,
  "code_hash": null,
  "policy_hash": null,
  "forecast_seal_id": null,
  "decision_id": null,
  "core_decision": "NO_MODEL_DECISION",
  "core_class": null,
  "evidence_level": "RESEARCH_ONLY",
  "data_origin": "UNKNOWN",
  "source_conflicts": [],
  "priced_market_count": 0,
  "alternatives_ge_2": [],
  "missing_data": [
    "SEFIROT_NOT_EXECUTED",
    "CURRENT_STATUS_NOT_ATTESTED",
    "NO_VERIFIED_ALTERNATIVE"
  ],
  "next_action": "OBTAIN_ORIGINAL_CORE_DECISION",
  "ticket_record": null,
  "audit_period": null,
  "monetary_permission": false,
  "live_state": null,
  "research_checks": []
}
